{
  "$id": "kp1979-label-lattice-synthetic-control-v2-execution.schema.json",
  "$schema": "https://json-schema.org/draft/2020-12/schema",
  "additionalProperties": false,
  "properties": {
    "claim_scope": {
      "$ref": "#/$defs/claim_scope"
    },
    "commitments": {
      "$ref": "#/$defs/commitments"
    },
    "control_id": {
      "const": "kp1979-label-lattice-synthetic-control-v2"
    },
    "deployment_constraints": {
      "$ref": "#/$defs/deployment_constraints"
    },
    "development_separation": {
      "$ref": "#/$defs/development_separation"
    },
    "execution_contract": {
      "$ref": "#/$defs/execution_contract"
    },
    "mandatory_gates": {
      "$ref": "#/$defs/mandatory_gates"
    },
    "plan_id": {
      "const": "kp1979-label-lattice-v2-execution-plan-v1"
    },
    "plan_version": {
      "const": "kp1979-label-lattice-synthetic-control-v2-execution-v1"
    },
    "result_state": {
      "const": "not_run"
    },
    "target_algorithm_id": {
      "const": "two-column-label-lattice-v2"
    }
  },
  "required": [
    "claim_scope",
    "commitments",
    "control_id",
    "deployment_constraints",
    "development_separation",
    "execution_contract",
    "mandatory_gates",
    "plan_id",
    "plan_version",
    "result_state",
    "target_algorithm_id"
  ],
  "title": "KP1979 V2 synthetic-control one-shot execution plan",
  "type": "object",
  "$defs": {
    "canonical_json": {
      "additionalProperties": false,
      "properties": {
        "duplicate_keys_allowed": {
          "const": false
        },
        "encoding": {
          "const": "utf-8"
        },
        "final_newline": {
          "const": true
        },
        "indent_spaces": {
          "const": 2
        },
        "key_order": {
          "const": "lexicographic"
        },
        "line_ending": {
          "const": "lf"
        },
        "non_finite_numbers_allowed": {
          "const": false
        }
      },
      "required": [
        "duplicate_keys_allowed",
        "encoding",
        "final_newline",
        "indent_spaces",
        "key_order",
        "line_ending",
        "non_finite_numbers_allowed"
      ],
      "type": "object"
    },
    "claim_scope": {
      "additionalProperties": false,
      "properties": {
        "accepted_reference": {
          "const": false
        },
        "code_transcription_validated": {
          "const": false
        },
        "decipherment": {
          "const": false
        },
        "evaluation_admissible": {
          "const": false
        },
        "full_row_segmentation_validated": {
          "const": false
        },
        "future_evaluation_opened": {
          "const": false
        },
        "future_pixels_opened": {
          "const": false
        },
        "identifier_transcription_validated": {
          "const": false
        },
        "language_identified": {
          "const": false
        },
        "meaning_assigned": {
          "const": false
        },
        "prize_submission_eligible": {
          "const": false
        },
        "prize_submission_made": {
          "const": false
        },
        "reading_direction_validated": {
          "const": false
        },
        "real_accuracy": {
          "const": false
        },
        "reserved_sources_read": {
          "const": false
        },
        "row_identity_validated": {
          "const": false
        },
        "sign_sequence_validated": {
          "const": false
        },
        "translation": {
          "const": false
        }
      },
      "required": [
        "accepted_reference",
        "code_transcription_validated",
        "decipherment",
        "evaluation_admissible",
        "full_row_segmentation_validated",
        "future_evaluation_opened",
        "future_pixels_opened",
        "identifier_transcription_validated",
        "language_identified",
        "meaning_assigned",
        "prize_submission_eligible",
        "prize_submission_made",
        "reading_direction_validated",
        "real_accuracy",
        "reserved_sources_read",
        "row_identity_validated",
        "sign_sequence_validated",
        "translation"
      ],
      "type": "object"
    },
    "commitments": {
      "additionalProperties": false,
      "properties": {
        "base_commit": {
          "const": "662b01c23d4d4e2336e248d79bc508c3b7ed5f66"
        },
        "control_commit": {
          "const": "e143a5ed5a8128d7b7e3626a3bf01607289ee7cc"
        },
        "control_manifest": {
          "additionalProperties": false,
          "properties": {
            "path": {
              "const": "benchmark/kp1979-label-lattice-synthetic-control-v2.json"
            },
            "sha256": {
              "const": "ee368613138f2ccb89686872ff127504f0627b2df662edef3b5a0486583f870f"
            }
          },
          "required": [
            "path",
            "sha256"
          ],
          "type": "object"
        },
        "control_module": {
          "additionalProperties": false,
          "properties": {
            "path": {
              "const": "src/indusbench/kp1979_synthetic_control_v2.py"
            },
            "sha256": {
              "const": "7674968043476cc366cf7f0a73daf588d4cea8695a3c6fd368bf1c3d730ebab9"
            }
          },
          "required": [
            "path",
            "sha256"
          ],
          "type": "object"
        },
        "detector_commit": {
          "const": "5f059032ed9ee1e790c4c668047510f8e1cd60d5"
        },
        "detector_module": {
          "additionalProperties": false,
          "properties": {
            "path": {
              "const": "src/indusbench/printed_concordance_layout_v2.py"
            },
            "sha256": {
              "const": "2540310dad612080034ab89f37cff96ce3341d1fc93d2fa44c0c86a78ccd66a4"
            }
          },
          "required": [
            "path",
            "sha256"
          ],
          "type": "object"
        },
        "detector_wheel": {
          "additionalProperties": false,
          "properties": {
            "sha256": {
              "const": "7861a7e435d8221ac9c95a12e232c988533bba9c803b30f470384d2e9476a5cb"
            }
          },
          "required": [
            "sha256"
          ],
          "type": "object"
        },
        "scorer_module": {
          "additionalProperties": false,
          "properties": {
            "path": {
              "const": "src/indusbench/kp1979_label_scoring.py"
            },
            "sha256": {
              "const": "56bdcfe869f96e043acadabe44d839bce97891b5c1eb81604e72874fce4b48ba"
            }
          },
          "required": [
            "path",
            "sha256"
          ],
          "type": "object"
        },
        "uv_lock": {
          "additionalProperties": false,
          "properties": {
            "path": {
              "const": "uv.lock"
            },
            "sha256": {
              "const": "d916009109bb939157fe248d613398ddc21735871704117dfa1ea1e00b7c2443"
            }
          },
          "required": [
            "path",
            "sha256"
          ],
          "type": "object"
        },
        "worker_module": {
          "additionalProperties": false,
          "properties": {
            "path": {
              "const": "src/indusbench/kp1979_detector_v2_worker.py"
            },
            "sha256": {
              "const": "4405774a8c544da5d09eb313025b40757ddfe6acc12dfa5013406e3c3f5326c4"
            }
          },
          "required": [
            "path",
            "sha256"
          ],
          "type": "object"
        }
      },
      "required": [
        "base_commit",
        "control_commit",
        "control_manifest",
        "control_module",
        "detector_commit",
        "detector_module",
        "detector_wheel",
        "scorer_module",
        "uv_lock",
        "worker_module"
      ],
      "type": "object"
    },
    "deployment_constraints": {
      "additionalProperties": false,
      "properties": {
        "future_evaluation_execution_authorized": {
          "const": false
        },
        "postfreeze_periodic_confound_deployment_block": {
          "const": true
        },
        "provisional_extraction_authorized": {
          "const": false
        },
        "real_source_detector_execution_authorized": {
          "const": false
        }
      },
      "required": [
        "future_evaluation_execution_authorized",
        "postfreeze_periodic_confound_deployment_block",
        "provisional_extraction_authorized",
        "real_source_detector_execution_authorized"
      ],
      "type": "object"
    },
    "development_separation": {
      "additionalProperties": false,
      "properties": {
        "blindness_verified": {
          "const": false
        },
        "confidentiality_verified": {
          "const": false
        },
        "cross_access_absence_verified": {
          "const": false
        },
        "custody_verified": {
          "const": false
        },
        "filesystem_isolation_verified": {
          "const": false
        },
        "git_proves_only_bytes_and_ancestry": {
          "const": true
        },
        "independence_verified": {
          "const": false
        },
        "mutual_nonexposure_declared": {
          "const": true
        },
        "network_isolation_verified": {
          "const": false
        },
        "organizational_independence_verified": {
          "const": false
        },
        "process_separation_declared": {
          "const": true
        },
        "public_remote_independently_attested": {
          "const": false
        },
        "trusted_time_verified": {
          "const": false
        }
      },
      "required": [
        "blindness_verified",
        "confidentiality_verified",
        "cross_access_absence_verified",
        "custody_verified",
        "filesystem_isolation_verified",
        "git_proves_only_bytes_and_ancestry",
        "independence_verified",
        "mutual_nonexposure_declared",
        "network_isolation_verified",
        "organizational_independence_verified",
        "process_separation_declared",
        "public_remote_independently_attested",
        "trusted_time_verified"
      ],
      "type": "object"
    },
    "execution_contract": {
      "additionalProperties": false,
      "properties": {
        "canonical_attempt_state_required": {
          "const": true
        },
        "canonical_json": {
          "$ref": "#/$defs/canonical_json"
        },
        "detector_control_preflight_allowed": {
          "const": false
        },
        "empty_working_directory_required": {
          "const": true
        },
        "environment_allowlist_only": {
          "const": true
        },
        "expected_invocation_count": {
          "const": 25
        },
        "fresh_process_per_invocation": {
          "const": true
        },
        "loaded_module_paths_verified": {
          "const": true
        },
        "official_valid_execution_limit": {
          "const": 1
        },
        "output_policy": {
          "const": "atomic_no_replace"
        },
        "preimport_code_execution_excluded": {
          "const": false
        },
        "public_main_ref_preflight_required": {
          "const": true
        },
        "retry_after_any_control_invocation_allowed": {
          "const": false
        },
        "single_execution_technically_enforced": {
          "const": false
        },
        "structurally_invalid_execution_writes_result": {
          "const": false
        },
        "valid_input_invalid_request_fails_closed": {
          "const": true
        },
        "worker_interface_version": {
          "const": "kp1979-label-detector-v2-worker-v1"
        },
        "worker_internal_failure_cause_distinguishable": {
          "const": false
        },
        "worker_request_fields": {
          "const": [
            "height",
            "interface_version",
            "pbm_base64",
            "scan_bands",
            "width"
          ]
        },
        "worker_response_fields": {
          "const": [
            "abstention_codes",
            "algorithm_id",
            "interface_version",
            "predictions",
            "status"
          ]
        }
      },
      "required": [
        "canonical_attempt_state_required",
        "canonical_json",
        "detector_control_preflight_allowed",
        "empty_working_directory_required",
        "environment_allowlist_only",
        "expected_invocation_count",
        "fresh_process_per_invocation",
        "loaded_module_paths_verified",
        "official_valid_execution_limit",
        "output_policy",
        "preimport_code_execution_excluded",
        "public_main_ref_preflight_required",
        "retry_after_any_control_invocation_allowed",
        "single_execution_technically_enforced",
        "structurally_invalid_execution_writes_result",
        "valid_input_invalid_request_fails_closed",
        "worker_interface_version",
        "worker_internal_failure_cause_distinguishable",
        "worker_request_fields",
        "worker_response_fields"
      ],
      "type": "object"
    },
    "mandatory_gates": {
      "additionalProperties": false,
      "properties": {
        "advance": {
          "const": false
        },
        "advance_requires_control_frozen_before_detector_commit": {
          "const": true
        },
        "advance_requires_no_postfreeze_deployment_block": {
          "const": true
        },
        "advance_requires_raw_control_qualified": {
          "const": true
        },
        "control_frozen_before_detector_commit": {
          "const": false
        },
        "postfreeze_periodic_confound_deployment_block": {
          "const": true
        },
        "raw_control_status_is_separate": {
          "const": true
        },
        "terminal_status": {
          "const": "not_qualified"
        }
      },
      "required": [
        "advance",
        "advance_requires_control_frozen_before_detector_commit",
        "advance_requires_no_postfreeze_deployment_block",
        "advance_requires_raw_control_qualified",
        "control_frozen_before_detector_commit",
        "postfreeze_periodic_confound_deployment_block",
        "raw_control_status_is_separate",
        "terminal_status"
      ],
      "type": "object"
    }
  }
}
